doc_id,rule_name,category,span_text,context
4936,BODY,BODY,mouth,where your judgemental mouth is. I welcome
4936,PERSON,PERSON,artist,"Bocelli, as an artist, completely. It appears"
4936,PERSON,PERSON,people,"the slinging these people are doing, they"
4936,PERSON,PERSON,singers,tenors or pop singers of this time.
4936,PERSON,PERSON,singers,"to other opera singers, then throw him"
4936,PERSON,PERSON,singers,"of all the singers, pop, opera and"
4936,PERSON,PERSON,fans,all of his fans. It is not
4936,PERSON,PERSON,people,"because it makes people that are fair,"
4937,BODY,BODY,ears,"role, (to my ears)displaying more strength and"
4937,BODY,BODY,feeling,considerable depth of feeling and sincerity which
4937,PERSON,PERSON,fans,some classical music fans are opposed to
4938,BODY,BODY,teeth,"Gergiev gets his teeth into the ""Dies"
4938,BODY,BODY,throat,listener by the throat and doesn't let
4938,BODY,BODY,touching,"at times, genuinely touching, the overall effect"
4938,BODY,BODY,hearing,"I can remember hearing.The recording belongs, appropriately,"
4938,BODY,BODY,throat,from his famous throat and shall probably
4938,BODY,BODY,chest,"to a growling chest voice and, likewise,"
4938,BODY,BODY,feeling,passages without any feeling of pushing the
4938,BODY,BODY,body,is the main body of the work
4938,PLACE,PLACE,room,out of the room by the sudden
4938,PLACE,PLACE,room,for the living room listener. Almost every
4938,PERSON,PERSON,singer,is.D'Archangelo is a singer to watch. If
4939,BODY,BODY,feeling,"his gift, or feeling sorry for himself,"
4939,BODY,BODY,feeling,is enough negative feeling in this world
4939,BODY,BODY,feeling,little more positive feeling in it. I
4939,PERSON,PERSON,people,"work, but real people, part of the"
4939,PERSON,PERSON,my mother,silent. Or as my mother used to
4940,BODY,BODY,blood,temporarily) his Russian blood and sails through
4941,PERSON,PERSON,singer,a first-rank opera singer. What on earth
4944,BODY,BODY,hearing,"Bruckner is worth hearing and even owning,"
4944,BODY,BODY,hearing,"Both are worth hearing and knowing, although"
4944,BODY,BODY,hearing,because they're worth hearing and returning to.
4947,BODY,BODY,hearing,a dutiful first hearing.No competition here for
4947,BODY,BODY,ears,"Guide*). To my ears, however, I still"
4947,MEMORY,MEMORY,years ago,"a number of years ago, I must"
4948,BODY,BODY,hand,the text at hand to confirm it.
4948,PERSON,PERSON,listeners,seriously discommode non-French-speaking listeners.Whatever one may think
4948,PERSON,PERSON,singers,think of the singers or the packaging
4958,BODY,BODY,tongue,music corresponds. Mercury's tongue-in-cheek sections are fun
4958,PERSON,PERSON,singer,(where the earlier singer hit some embarrassingly
4970,PLACE,PLACE,College,in the Mertin College and is an
4971,BODY,BODY,hearing,lyrics for meaningful hearing.--Other pieces--As an added
4971,PERSON,PERSON,singers,male and female singers who have trained
4972,PERSON,PERSON,singers,male and female singers who have trained
4975,BODY,BODY,teeth,to sink their teeth into. The programme
4975,PLACE,PLACE,School,at Dunblane Primary School in 1996; the
4975,PLACE,PLACE,College,Service at King's College Cambridge and giving
4998,BODY,BODY,touch,"subject he may touch. So, here, his"
4998,PLACE,PLACE,city,Berlioz is a city dweller orphaned of
4998,PLACE,PLACE,University,"insanity.Dr Jacques COULARDEAU, University of Perpignan"
5002,PLACE,PLACE,College,passionate. The King's College Choir sings with
5010,BODY,BODY,feeling,"and although the feeling was mutual, she"
5013,BODY,BODY,feeling,"pay, in the feeling, at times, that"
5013,BODY,BODY,hand,"the score in hand. In one case,"
5013,BODY,BODY,feeling,"no loss of feeling, thanks to the"
5013,BODY,BODY,ears,"of approach. Four ears, four opinions."
5014,BODY,BODY,tears,this music with tears in his eyes?)
5014,BODY,BODY,eyes,tears in his eyes?) The accents in
5067,BODY,BODY,ears,deadly to everyone's ears.Kurt Masur recorded this
5069,BODY,BODY,hearing,the thought of hearing Concerto No. 1
5069,PLACE,PLACE,room,and filled the room with amazing colors
5070,MEMORY,MEMORY,not forget,Finally one must not forget to mention
5071,BODY,BODY,ears,"To my antipodean ears, they all sound"
5077,MEMORY,MEMORY,memories of,will not erase memories of Copland's two
5099,PERSON,PERSON,singers,the pitfalls of singers contracting with various
5101,MEMORY,MEMORY,reminds me of,at times Schnittke reminds me of Prokofiev
5101,PERSON,PERSON,listeners,therefore D. SCH.]Most listeners will find the
5103,BODY,BODY,ears,him straining his ears to the point
5103,BODY,BODY,ears,the most learned ears. Decca has included
5104,PERSON,PERSON,Singers,"set by Boulez/BPhH/BBC Singers (et al.), I"
5105,MEMORY,MEMORY,years ago,and a hundred years ago after Gustav
5105,PERSON,PERSON,singers,to giving his singers space to breathe
5105,PERSON,PERSON,singers,harmonic structure).And what singers! Every member of
5105,PERSON,PERSON,People,the last century. People still debate whether
5105,PERSON,PERSON,people,story about particular people living in a
5115,BODY,BODY,hand,with a firm hand. The scherzo is
5115,BODY,BODY,hand,On the other hand Fischer includes some
5118,BODY,BODY,touch,the piece's romantic touch. And again du
5118,PERSON,PERSON,listeners,"exhilarating presence.As many listeners have known, a"
5119,BODY,BODY,ears,"long. To my ears, it has a"
5119,BODY,BODY,hand,in Bruckner's own hand: the original 1887
5119,PLACE,PLACE,bar,(a little 7 bar remniscence of the
5131,BODY,BODY,touch,"natural phrasing, beautiful touch and was a"
5131,BODY,BODY,hand,"in his right hand, and his recordings"
5131,PERSON,PERSON,listeners,pick for most listeners (try MichelangeliRavel: Piano
5132,BODY,BODY,hearing,"a discount label. hearing that alone, the"
5132,BODY,BODY,hand,"on the other hand, begins with finger"
5144,BODY,BODY,touch,cool to the touch. Instead it sizzles
5144,PLACE,PLACE,City,"in New York City, is that concerts"
5144,PLACE,PLACE,concert hall,conductors in the concert hall. And not
5146,BODY,BODY,ears,"back. To my ears, the Boulez recording"
5146,PERSON,PERSON,fans,is for Barbirolli fans only.
5151,PLACE,PLACE,city,"lived, Segovia, the city of Saint John"
5151,PLACE,PLACE,city,"the most picturesque city in Europe, plus"
5152,BODY,BODY,touch,wide variety of touch and with coloration
5152,BODY,BODY,touch,and varieties of touch. I've never heard
5152,PERSON,PERSON,artists,including only the artists who have touched
5152,PERSON,PERSON,artist,expressive of the artist's conception of the
5152,PERSON,PERSON,people,Vlaeva; too many people who really love
5152,PERSON,PERSON,artists,star.I've heard various artists praised for everything
5163,BODY,BODY,touch,and lightness of touch. A real delight.
5163,BODY,BODY,hand,in the left hand make the piano
5163,MEMORY,MEMORY,childhood,Rubbra since his childhood and you hear
5164,BODY,BODY,hearing,limit for human hearing.)But enough of mind-numbing
5164,BODY,BODY,hearing,by Glazounov from hearing him perform it
5164,MEMORY,MEMORY,reminds me of,have imagined. It reminds me of Tchaikovsky's
5164,PERSON,PERSON,artists,"Prince Igor, the artists and technicians apparently"
5164,PERSON,PERSON,listeners,"of recorded music listeners, for there was"
5171,PLACE,PLACE,room,there's not enough room here for much
5171,PERSON,PERSON,fans,"Needless to say, fans of the great"
5174,BODY,BODY,hand,on the other hand even more dramatically
5174,BODY,BODY,hand,"on the other hand, Beno Blachut's Dalibor"
5177,BODY,BODY,hand,"well, it's a hand-picked cast and would"
5177,BODY,BODY,heart,the composer is heart-stopping. Said composer is
5177,PLACE,PLACE,house,"in lush, big-house Strauss territory, but as"
5177,PERSON,PERSON,singers,"my very favourite singers, so it would"
5177,PERSON,PERSON,singers,"skill.As for the singers: well, it's a"
5179,PERSON,PERSON,artist,there is an artist whom I admit
5180,MEMORY,MEMORY,memories of,"never erase the memories of Tatiana Troyanos,"
5180,PERSON,PERSON,artists,"Otter, and Dohmen, artists of a prime"
5180,PERSON,PERSON,artist,of this great artist's skill in turning
5187,BODY,BODY,feeling,"Main Street, all feeling the joys of"
5187,PERSON,PERSON,listeners,"alive to young listeners. It is, after"
5187,PERSON,PERSON,fans,"Classical Kids' many fans, and for that,"
5188,BODY,BODY,hearing,frustration factor of hearing only disjointed *pieces*
5188,PERSON,PERSON,my friend,"it away, hoping my friend and her"
5188,PERSON,PERSON,singers,use mediocre child singers and narrators for
5188,PERSON,PERSON,fans,to become great fans of the Met's
5195,PERSON,PERSON,singer,of the young singer.This is the earliest
5195,PERSON,PERSON,singer,the 26-year old singer and to realize
5195,PERSON,PERSON,singer,"a dull, undistinguished singer who doesn't bother"
5200,PLACE,PLACE,room,to a quiet room and giving this
5207,BODY,BODY,cry,thunderin in full cry.The final scene offers
5207,BODY,BODY,eye,"on with an eye toward the future,"
5207,BODY,BODY,hearing,masterpieceworth having and hearing.
5207,PLACE,PLACE,concert hall,afternoon at a concert hall - or
5208,PLACE,PLACE,on the road,brilliant brass passages on the road to
5208,PLACE,PLACE,School,in the Medical School at Salerno scene
5211,BODY,BODY,feeling,that he kept feeling the need to
5219,BODY,BODY,hand,"on the other hand, is pure feminine"
5219,BODY,BODY,heart,just rip your heart out.On Muti: I
5219,PERSON,PERSON,singers,ugliness that other singers sometimes pass off
5219,PERSON,PERSON,singers,he gave the singers plenty of time
5219,PERSON,PERSON,singers,"magnificent ensemble of singers, orchestra and condutor"
5220,PLACE,PLACE,house,"is a big house, big sound recording."
5221,BODY,BODY,ears,"unlistenable to my ears, but if you"
5221,PERSON,PERSON,listeners,Leinsdorf. For other listeners there is no
5221,PERSON,PERSON,fans,"opera, pace the fans of Toscanini, whose"
5231,BODY,BODY,gut,"the intense explosive, gut-wrenching performances, like rolling"
5231,BODY,BODY,chest,"sorts;,utilizing his bare chest as a drum,"
5231,BODY,BODY,blood,to get the blood moving as D.H
5231,BODY,BODY,blood,"peasantry, flushed with blood from a days"
5238,BODY,BODY,ears,"To these ears, Golijov's *Pasi&oacute;n* is"
5238,MEMORY,MEMORY,years ago,heard it 34 years ago. Golijov's play
5238,PERSON,PERSON,singers,letting both individual singers and the chorus
5238,PERSON,PERSON,listeners,most of Bach's listeners could not read.
5241,BODY,BODY,touch,his subtle pianistic touch make these performances
5241,PERSON,PERSON,listeners,the sole focus--modern listeners may find themselves
5242,PERSON,PERSON,artists,severely the proper artists to perform his
5243,BODY,BODY,nose,turn up his nose at such cat-wauling
5243,PERSON,PERSON,singer,being the better singer). Whenever they are
5244,BODY,BODY,hearing,prejudices audiences. But hearing and watching this
5244,BODY,BODY,touching,are as compellingly touching as any conductor
5244,PERSON,PERSON,listeners,Too often listeners pay little attention
5255,BODY,BODY,hand,"crease, willow in hand. Usually they are"
5256,BODY,BODY,ears,Defunctis. Unless my ears deceive me it's
5256,PERSON,PERSON,people,from 1791.For some people like me it
5258,PERSON,PERSON,artist,release from an artist who seems so
5259,PLACE,PLACE,bar,"sound different from bar to bar, sometimes"
5259,PLACE,PLACE,bar,"from bar to bar, sometimes effectively, sometimes"
5259,PLACE,PLACE,room,not as much room for funny business
5259,PERSON,PERSON,listeners,infuriating to some listeners. DG turns every
5266,BODY,BODY,ears,translated through postmodern ears. It's as if
5268,BODY,BODY,feeling,simply get the feeling that Scherchen may
5268,MEMORY,MEMORY,I recall,are pretty erratic. I recall with amusement
5268,PLACE,PLACE,House,Consecration of the House.[Update 4-15-08] While I
5269,BODY,BODY,ears,"generis. To my ears, the ensemble does"
5269,BODY,BODY,hand,"on the other hand, is the most"
5270,BODY,BODY,hand,"On the other hand, they play with"
5270,BODY,BODY,hand,"On the other hand, to be truthful,"
5270,PLACE,PLACE,bar,what Scherchen does bar-to-bar within that speed
5270,PLACE,PLACE,bar,Scherchen does bar-to-bar within that speed and
5270,PERSON,PERSON,people,slightly inebriated way--real people playing instruments instead
5373,PLACE,PLACE,room,tempos that give room for the music
5373,PLACE,PLACE,bar,"beat to the bar, but the brass"
5375,PERSON,PERSON,Listeners,has been overlooked. Listeners turn to the
5375,PERSON,PERSON,singers,"famous by the singers, Maria Callas and"
5375,PERSON,PERSON,people,"Druid priestess, whose people depend on her"
5375,PERSON,PERSON,people,Norma that most people rarely realize. She
5375,PERSON,PERSON,people,confession to her people and her dignity
5376,BODY,BODY,heart,"more of a heart. A light voice,"
5376,PERSON,PERSON,singer,as a unique singer in a role
5376,PERSON,PERSON,singers,performance that few singers of her time
5376,PERSON,PERSON,artist,"but sadly misunderstood artist, performs Norma with"
5376,PERSON,PERSON,singer,of any other singer and gives her
5377,BODY,BODY,breath,been tighter. Her breath control is very
5377,BODY,BODY,chest,"use of her chest register is sparing,"
5377,BODY,BODY,chest,"say abusing, her chest register. The sound"
5377,MEMORY,MEMORY,reminds me of,done. His voice reminds me of Pavarotti's.
5377,PERSON,PERSON,people,"opera. However, many people consider that recording"
5406,BODY,BODY,Heart,"Like Crown My Heart, the mesmerizing anthem"
5406,PLACE,PLACE,College,scholar at Magdalen College in Oxford. He
5406,PLACE,PLACE,College,"Chapel of King's College, Cambridge since 1990,"
5406,PERSON,PERSON,Singers,the Daily Service Singers that were broadcast
5406,PERSON,PERSON,singer,"also a choir singer, a conductor, a"
5406,PERSON,PERSON,singer,"it almost a singer without word, with"
5409,PERSON,PERSON,artist,such an imaginative artist that he seems
5409,PERSON,PERSON,artist,"what a great artist would do, give"
5411,BODY,BODY,ears,"not to my ears, but give the"
5411,BODY,BODY,feeling,the same intense feeling and a golden
5411,PERSON,PERSON,listeners,"fortunate for us listeners, because Schnabel gives"
5412,BODY,BODY,hand,"on the other hand, is long (16"
5412,PERSON,PERSON,fans,will appeal to fans of the composer's
5413,BODY,BODY,breath,"ran out of breath completely, and the"
5413,BODY,BODY,heart,these selections was heart. The notes were
5413,BODY,BODY,heart,"be missing was heart, the soul of"
5413,BODY,BODY,heart,"Italian style its heart, its soul, and"
5413,BODY,BODY,heart,"needed is more heart.However, it is not"
5413,PERSON,PERSON,singers,ALL of the singers in this collection
5413,PERSON,PERSON,singer,more like the singer ran out of
5413,PERSON,PERSON,singers,were perfect. The singers really sang well
5413,PERSON,PERSON,artists,"NONE of these artists (excepting Podles, who"
5413,PERSON,PERSON,singers,"All these mentioned singers knew Italian style,"
5413,PERSON,PERSON,singers,emotional attachment. These singers all sang to
5413,PERSON,PERSON,singers,"ALL of these singers have great talent,"
5413,PERSON,PERSON,singers,"all. ALL these singers sing out, with"
5413,PERSON,PERSON,singers,"sad, for these singers have so much"
5414,BODY,BODY,hearing,"a while without hearing Gould-Bach, or Argerich-Chopin,"
5414,BODY,BODY,ears,"With Hamelin, my ears cut through the"
5414,PERSON,PERSON,people,my review title):The people who criticize this
5414,PERSON,PERSON,listeners,"recital, he allows listeners to forget about"
5453,MEMORY,MEMORY,childhood,composed during his childhood.Complete sets of Mozart
5453,PERSON,PERSON,listeners,to encourage prospective listeners to make an
5469,BODY,BODY,chest,notes and a chest-voice many altos would
5469,BODY,BODY,heart,it shutters your heart...I stronly advise anyone
5469,PERSON,PERSON,singers,even hear the singers.Compared to this Abigaille
5479,BODY,BODY,hand,On the other hand Scherchen leads a
5487,BODY,BODY,tears,of fire and tears - and it
5487,MEMORY,MEMORY,souvenir,"recording as a souvenir, thirty odd years"
5487,MEMORY,MEMORY,souvenir,and a great souvenir of Carreras in
5491,PERSON,PERSON,artists,spots where the artists all of a
5506,BODY,BODY,hand,On the other hand Manze's choice of
5506,BODY,BODY,feeling,get that ethereal feeling again that the
5506,BODY,BODY,breath,will take your breath away with its
5511,PLACE,PLACE,bar,"my favorite CD, bar none.The reason why"
5511,PERSON,PERSON,artist,"composer, instrument and artist)... it is the"
5522,PERSON,PERSON,singers,the greatest Mozart singers of the time
5522,PERSON,PERSON,listeners,"in Europe. As listeners could hear immediately,"
5522,PERSON,PERSON,fans,For foty years fans of the opera
5522,PERSON,PERSON,listeners,CD. For many listeners what tilts the
5522,PERSON,PERSON,listeners,"has won many listeners over. Unfortunately, Bohm's"
5523,PERSON,PERSON,fans,"those digital Li fans, please do not"
5524,PLACE,PLACE,room,of the drawing room to the anonymity
5524,PERSON,PERSON,people,and Mazurkas. Yet people will forever persist
5525,PLACE,PLACE,room,and had much room for growing and
5525,PERSON,PERSON,artist,read that the artist was the 2000
5525,PERSON,PERSON,artists,"all cases, these artists have improved considerably"
5525,PERSON,PERSON,artist,"a refined, mature artist. And he is"
5526,BODY,BODY,touch,WONDERFULLY homogeneous legato touch that really show
5526,PLACE,PLACE,concert hall,Chopin spurning the concert hall for the
5526,PERSON,PERSON,my Dad,real name: that's my Dad's name you
5526,PERSON,PERSON,people,"nor the Chinese people (well, a little"
5526,PERSON,PERSON,people,towards the Chinese people - but it's
5526,PERSON,PERSON,people,slur and how people of the same
5526,PERSON,PERSON,people,"don't like Chinese people, you'll probably not"
5526,PERSON,PERSON,people,I guess such people will just have
5526,PERSON,PERSON,listeners,"directly to his listeners, but they're there"
5526,PERSON,PERSON,Listeners,"to coddle us. Listeners, too, must do"
5527,BODY,BODY,ears,"Koslowsky, to my ears, lacks the lilt"
5527,PLACE,PLACE,city,"in every major city of northern Italy,"
5527,PERSON,PERSON,singers,wish the five singers were not all
5527,PERSON,PERSON,listeners,likely that other listeners will not hear
5534,PLACE,PLACE,room,had lots of room to record the
5536,BODY,BODY,heart,"Fjord, the folklore heart of the country."
5536,PLACE,PLACE,house,in a 1971 house fire that burnt
5536,PERSON,PERSON,artists,composed by audience-friendly artists such as Jules
5540,BODY,BODY,feeling,putting so much feeling into the songs
5540,BODY,BODY,eyes,"aria, close your eyes and see Maria"
5540,BODY,BODY,feeling,stage. So much feeling and depth. Only
5540,BODY,BODY,chest,"down into her chest voice, again, very"
5540,BODY,BODY,crying,like Maria is crying when she sings
5540,BODY,BODY,crying,like she is crying. This very much
5540,BODY,BODY,tears,break down into tears on those phrases.
5540,BODY,BODY,feeling,"expressive. Many emotions, feeling and power are"
5540,BODY,BODY,chest,"control, head and chest voice. For sure,"
5540,BODY,BODY,chest,"down to the chest voice, sounding a"
5540,BODY,BODY,heart,well as your heart.Un bel di (from
5540,BODY,BODY,eyes,"you close your eyes, you can picture"
5540,BODY,BODY,feeling,and all the feeling. No other words
5540,PERSON,PERSON,fans,"for all opera fans, Maria fan or"
5540,PERSON,PERSON,people,"or not. Many people ask- ""Did Maria"
5540,PERSON,PERSON,singers,aria from many singers.La mamma morta (from
5540,PERSON,PERSON,singers,is with most singers who are afraid
5540,PERSON,PERSON,People,a Mozart aria. People think that Maria's
5541,BODY,BODY,eyes,never took her eyes off the goal.
5541,PERSON,PERSON,artist,"that no other artist, save for Van"
5541,PERSON,PERSON,singer,"ever been a singer, whether popular or"
5541,PERSON,PERSON,artist,about every major artist of the last
5541,PERSON,PERSON,artists,and so few artists have even bothered
5541,PERSON,PERSON,artist,was a complete artist: everything mattered to
5541,PERSON,PERSON,singer,the only opera singer I know of
5545,BODY,BODY,chest,has blown your chest &quot;THUD!&quot;. Try listening
5545,PERSON,PERSON,people,"favorite with many people out there, including"
5550,BODY,BODY,cry,does seem to cry for an orchestral
5550,BODY,BODY,hand,"to the left-hand details.""Legend"" is a Walz"
5552,BODY,BODY,hand,"On the other hand, there are numerous"
5552,PERSON,PERSON,singers,beautiful. Given great singers and a proper
5552,PERSON,PERSON,singers,"these CDs, the singers are favoured and"
5553,BODY,BODY,breath,space to draw breath through long passages)
5553,BODY,BODY,shiver,that subtle pitch-shiver is a beauty.Craft's notes
5553,BODY,BODY,shiver,"before the harp/sarrusophone shiver I mention, the"
5553,PERSON,PERSON,singers,a group of singers who can sing
5553,PERSON,PERSON,singers,to note the singers' nothing-short-of-marvelous accuracy. Heaven
5553,PERSON,PERSON,singers,Joly and his singers.As may be seen
5554,BODY,BODY,hearing,great difference between hearing four actual pianos
5554,BODY,BODY,hearing,"passage together, and hearing MIDI notes that"
5554,BODY,BODY,ears,"playing, but my ears refused to offer"
5554,PERSON,PERSON,singers,"part of the singers, is rather more"
5556,BODY,BODY,hand,its whirling left-hand accompaniment is played with
5556,BODY,BODY,hand,"on the other hand, is a real"
5556,BODY,BODY,hand,"that trudging left-hand, but others like Arrau"
5556,BODY,BODY,hand,with less left-hand emphasis and it works
5560,MEMORY,MEMORY,years ago,made over 50 years ago (proving that
5560,PERSON,PERSON,artist,truly embodied the artist's original/ individual `vision'
5560,PERSON,PERSON,people,"ago (proving that people, not technology, were"
5561,BODY,BODY,feeling,march that same feeling of power is
5562,BODY,BODY,heart,"dramatic tension and heart-rending lyricism, and they"
5568,PLACE,PLACE,COLLEGE,BY THE KING'S COLLEGE CHOIR AND SELECTED
5568,PLACE,PLACE,College,Choir of King's College is first rate
5568,PERSON,PERSON,singers,expected from experienced singers of this genre.The
5570,PERSON,PERSON,fans,"foundation. For VIOLA fans, the alluring and"
5579,BODY,BODY,heart,"of Rachmaninoff's ""heart of gold"" here; nor"
5579,BODY,BODY,hearing,"that right after hearing these greats, one"
5579,BODY,BODY,touch,"out"". How?Freire's finishing touch came from Friedrich"
5579,PLACE,PLACE,room,one still has room for Freire and
5580,BODY,BODY,hand,53.In the other hand we have to
5580,BODY,BODY,heart,character where the heart talks us: the
5580,BODY,BODY,hand,"in the other hand, being Poland the"
5580,MEMORY,MEMORY,nostalgic,"have to the nostalgic mood, understood as"
5580,MEMORY,MEMORY,memories of,understood as reminiscent memories of his beloved
5580,PLACE,PLACE,school,"why the Russian school (Richter, Gilels, Bergman,"
5580,PLACE,PLACE,school,Freire belongs this school; but the list
5580,PLACE,PLACE,school,basically the British school; and the other
5580,PERSON,PERSON,artist,in this last artist and that was
5581,BODY,BODY,touch,an unusually sublime touch when it comes
5581,BODY,BODY,feeling,played with more feeling than I usually
5581,BODY,BODY,nose,"out by a nose (in Louisville-speak, that's"
5582,BODY,BODY,hand,The disc at hand collects together their
5582,PERSON,PERSON,fans,checking out for fans of twentieth century
5584,BODY,BODY,breath,a sheer composite breath of vitality and
5584,PERSON,PERSON,listeners,that knocks the listeners right off.In both
5585,PERSON,PERSON,people,Many people seem to get
5585,PERSON,PERSON,people,a composer.I recommend people like Vladimir Ashkenazy
5587,BODY,BODY,eyes,seen through the eyes of Franz Liszt
5587,BODY,BODY,eyes,seen through the eyes of that great
5587,BODY,BODY,hearing,"listener upon each hearing, with new discoveries"
5587,MEMORY,MEMORY,memories of,"played magnificently, evoking memories of Horowitz and"
5589,BODY,BODY,chest,voice to a chest register. Piero Cappuccilli's
5589,PERSON,PERSON,singers,"years, many remarkable singers have come across"
5590,MEMORY,MEMORY,I recall,"(Callas, the other) I recall as a"
5590,PLACE,PLACE,college,recall as a college student going to
5590,PERSON,PERSON,artists,what great operatic artists do. Run to
5591,PERSON,PERSON,singer,"considerations of a singer, or impresario, ran"
5591,PERSON,PERSON,singers,a time when singers were encouraged to
5591,PERSON,PERSON,singer,"drama. Therefore, a singer could interpolate ""verismo"""
5591,PERSON,PERSON,singers,of the finest singers of the twentieth
5591,PERSON,PERSON,singer,always a sensitive singer and his interpretation
5591,PERSON,PERSON,artists,there were few artists available to play
5592,BODY,BODY,touch,"is a wonderful touch in the ""Mad"
5592,BODY,BODY,feeling,"gets the the feeling, from Sills' singing"
5592,MEMORY,MEMORY,years ago,on vinyl many years ago and have
5592,PERSON,PERSON,singers,the orchestra and singers into a frenzy).
5592,PERSON,PERSON,singers,spectacular group of singers to work with!Sills
5592,PERSON,PERSON,singer,a really serious singer need only to
5592,PERSON,PERSON,singer,WAS a great singer/musician and took her
5593,BODY,BODY,ears,beautiful (to my ears) tone than Pavarotti.
5593,BODY,BODY,chest,voice (both use chest tones to an
5593,BODY,BODY,hearing,and musician for hearing and seeing any
5593,MEMORY,MEMORY,years ago,Regnava nel silenzio years ago on the
5593,PLACE,PLACE,my car,was stolen from my car and the
5593,PLACE,PLACE,my car,"stolen again from my car, so Amanzon"
5593,PERSON,PERSON,artists,are both beloved artists that have provided
5594,BODY,BODY,touch,"perhaps just a touch over the top,"
5594,BODY,BODY,feet,in with both feet and order it.
5594,PLACE,PLACE,room,need to make room on your shelves
5594,PERSON,PERSON,artists,singing of the artists were not at
