doc_id,rule_name,category,span_text,context
8816,PERSON,PERSON,artists,"wide variety of artists over the years,"
8822,BODY,BODY,hand,"has a real hand for anything British,"
8822,MEMORY,MEMORY,nostalgia,wistful bits of nostalgia that will remind
8822,PERSON,PERSON,singers,"group of fabulous singers, perhaps in part"
8824,BODY,BODY,touch,"benefit from a touch more expansiveness, particularly"
8824,MEMORY,MEMORY,memories of,enough to efface memories of some of
8824,PLACE,PLACE,room,a bit more room to expand than
8828,BODY,BODY,ears,for my untrained ears. There were no
8829,BODY,BODY,touch,"King Midas golden touch, the finest possible"
8829,BODY,BODY,ears,all. Letting my ears and mind and
8829,BODY,BODY,heart,and mind and heart seep past those
8829,BODY,BODY,Hearing,or animated passages. Hearing him do this
8829,BODY,BODY,touch,to an Oppo touch of a button.
8829,BODY,BODY,feeling,the extrovert mad feeling of the preceding
8829,BODY,BODY,feeling,A mood? A feeling? Before one can
8829,BODY,BODY,blood,"tasted Fafner's spilled blood, we really do"
8829,BODY,BODY,eyes,we trust our eyes or ears? Do
8829,BODY,BODY,ears,our eyes or ears? Do we partly
8829,PLACE,PLACE,room,"in my listening room, jaw dropped and"
8833,PERSON,PERSON,singer,- and a singer previously unknown to
8848,BODY,BODY,ears,bit to my ears. A single French
8848,PLACE,PLACE,University,gratitude for the University of Breslau bestowing
8848,PLACE,PLACE,school,graduates from high school and college have
8848,PLACE,PLACE,college,high school and college have walked to.
8849,BODY,BODY,hand,"On the other hand, Janowski's cycle comes"
8849,BODY,BODY,eye,with a keen eye on the underlying
8849,PERSON,PERSON,listeners,the benchmark for listeners who desire passion
8866,BODY,BODY,heart,"Zossima to her heart's content. Instead, she"
8866,BODY,BODY,heart,lies at the heart of Schumann. Yudina
8866,PLACE,PLACE,house,"in a mad-house, it pays to be"
8866,PLACE,PLACE,bar,"Like Solokov, every bar attests to her"
8874,PLACE,PLACE,school,of the minimalist school will likely enjoy
8874,PERSON,PERSON,listeners,rhythms. To most listeners I suspect this
8874,PERSON,PERSON,Fans,preparing this review. Fans of the minimalist
8874,PERSON,PERSON,listeners,"over any new listeners. For one thing,"
8874,PERSON,PERSON,singer,covers the bass singer. His text setting
8880,BODY,BODY,touch,much more human touch.Along with the wild
8881,BODY,BODY,eyes,chills and moist eyes when they take
8881,BODY,BODY,feeling,"forward with a feeling of inevitability, the"
8883,PERSON,PERSON,Fans,"the Fifth Sonata. Fans of Scriabin, Roslavets,"
8884,PERSON,PERSON,people,would attract many people who would not
8884,PERSON,PERSON,listeners,"appeal to adventurous listeners, to those who"
8885,BODY,BODY,ears,"Well, to my ears, it is the"
8885,PLACE,PLACE,house,"to ""bet the house"" in order to"
8886,PERSON,PERSON,artists,the tradition of artists like Mozart and
8903,BODY,BODY,touch,a firmness of touch that I prefer
8903,PLACE,PLACE,club,kind of hedgerows-and-Housman club. No wonder the
8903,PERSON,PERSON,artists,"Donohoe. However these artists are themselves English,"
8904,BODY,BODY,body,"left a large body of instrumental works,"
8904,PLACE,PLACE,University,"at Iowa State University (located in Ames,"
8912,BODY,BODY,hearing,mostly disappointing. After hearing his second-to-none readings
8914,BODY,BODY,eye,and keeps an eye on the overall
8914,PERSON,PERSON,people,hostile to the people'. The symphony remained
8915,PERSON,PERSON,artist,to reflect the artist involved. Many people
8915,PERSON,PERSON,people,artist involved. Many people have thought that
8920,BODY,BODY,feet,"light on its feet.The ""Reformation"" Sym. remains"
8920,BODY,BODY,touch,a lightness of touch that is very
8920,BODY,BODY,ears,listen with fresh ears. In the case
8920,PERSON,PERSON,listeners,fleet tempos. Some listeners may miss the
8920,PERSON,PERSON,people,long time since people couldn't wait to
8926,BODY,BODY,touch,nobody else could touch him. His Chicago
8926,BODY,BODY,ears,"that, to my ears, is usually completely"
8926,BODY,BODY,ears,seems (to my ears) to rob some
8926,PLACE,PLACE,hotel,recording in a hotel ballroom and wring
8926,PLACE,PLACE,room,because of the room's acoustics. There's very
8927,PLACE,PLACE,Hotel,"session at the Hotel St. George, Brooklyn,"
8927,PLACE,PLACE,hotel,"place in the hotel's massive Colorama Ballroom,"
8927,PLACE,PLACE,room,"Ballroom, an enormous room, which sounds every"
8929,PLACE,PLACE,bar,of the third bar after rehearsal number
8929,PLACE,PLACE,bar,with the last bar! The upbeat run
8934,BODY,BODY,tears,final bars brought tears to my eyes.
8934,BODY,BODY,eyes,tears to my eyes. It's good stuff.The
8934,BODY,BODY,hand,"On the other hand, Larmore alone (track"
8934,BODY,BODY,blood,track is a blood and guts duet
8934,PLACE,PLACE,bar,really sets the bar high for other
8934,PERSON,PERSON,singers,"high for other singers.Thankfully, Larmore goes out"
8934,PERSON,PERSON,singer,with this fearless singer. The Don Carlos
8934,PERSON,PERSON,singer,disc. Orchestra and singer match brilliantly and
8934,PERSON,PERSON,singer,is a generous singer and part of
8934,PERSON,PERSON,artists,works off other artists.As with every Larmore
8976,BODY,BODY,hand,on the one hand and fear and
8976,BODY,BODY,hearing,"is anyway worth hearing, and there is"
8976,PERSON,PERSON,artist,Sj&ouml;gren as an artist and in the
8977,BODY,BODY,blood,have some Swedish blood because I almost
8986,PERSON,PERSON,people,sort of way: people who enjoy film
8988,PERSON,PERSON,listeners,to suggest that listeners are just as
8990,BODY,BODY,hand,"On the other hand, he handles crescendo/diminuendo"
8990,BODY,BODY,ears,excellent to my ears. You have the
8990,PLACE,PLACE,room,"performance, leaving little room for nuance in"
8990,PLACE,PLACE,concert hall,you're in a concert hall with some
8991,BODY,BODY,ears,bad to my ears. The lower strings
8995,BODY,BODY,hearing,"delight comes from hearing ideas fully formed,"
8995,BODY,BODY,touch,her sureness of touch and phrase are
8995,PLACE,PLACE,house,in a fun house mirror. Happily Charlotte
8997,BODY,BODY,feeling,one very easily feeling that it's simply
8997,PERSON,PERSON,fans,Chicago and other fans of the CSO
8997,PERSON,PERSON,fans,"efforts.In my opinion, fans of Haitink are"
8998,BODY,BODY,touch,"necessary sensitivity of touch, the craggy first"
8998,PLACE,PLACE,house,on their new house label CSO resound.
8999,MEMORY,MEMORY,years ago,to Solti twenty years ago for the
8999,PLACE,PLACE,house,but this in-house effort seems just as
9000,BODY,BODY,hearing,even a casual hearing reveals the significant
9000,BODY,BODY,ears,early 21st century ears. These are certainly
9000,PLACE,PLACE,hospital,war in an hospital for the mentally
9005,BODY,BODY,ears,"were plugging their ears with their fingers,"
9005,PLACE,PLACE,house,live in the house when the entire
9005,PERSON,PERSON,singers,focus on the singers. No one disappears
9006,PERSON,PERSON,singer,certainly takes a singer of Ridderbusch's caliber
9007,BODY,BODY,ears,will ravish the ears. Those who like
9007,MEMORY,MEMORY,nostalgic,treat. This is nostalgic Beethoven that will
9007,PERSON,PERSON,people,these works. Some people will find the
9007,PERSON,PERSON,listeners,as some experienced listeners point to this
9020,PLACE,PLACE,club,local German jazz club. But it's worth
9022,MEMORY,MEMORY,made me think of,use of brass made me think of
9043,BODY,BODY,Hand,"for the Left Hand with, again, Robert"
9043,PERSON,PERSON,people,"which are most people's favorite works, but"
9044,PERSON,PERSON,people,"Stokowski, because many people falsely claim that"
9046,BODY,BODY,Hearing,interesting if disturbing. Hearing the tenor belt
9046,PERSON,PERSON,fans,"challenged, and Stokowski fans. Recommended."
9050,BODY,BODY,hearing,"consist, on first hearing, of one fine"
9050,BODY,BODY,body,the dead child's body in her arms.
9050,PERSON,PERSON,listeners,popularity among both listeners and critics alike.
9061,BODY,BODY,ears,"faulty. However, my ears are not deceiving"
9061,MEMORY,MEMORY,years ago,"LP collection may years ago, I was"
9061,MEMORY,MEMORY,I remember,"LP incarnation; indeed, I remember the voices"
9061,PERSON,PERSON,listeners,not bother many listeners. And the sumptuous
9062,BODY,BODY,touching,is a hugely touching vulnerability to Forrester's
9062,PERSON,PERSON,people,under so many people's radar - including
9062,PERSON,PERSON,singer,without leaving the singer no option but
9062,PERSON,PERSON,singers,"too, are these singers. In reviewing his"
9063,PERSON,PERSON,people,vibrancy to many people's first and ideal
9063,PERSON,PERSON,artist,have that beloved artist's refulgence in the
9064,PERSON,PERSON,singer,an Englis oratorio singer whohas somehow wandered
9067,PERSON,PERSON,my friends,"copies to give my friends, and I"
9069,PERSON,PERSON,people,don't think that people have always been
9078,PERSON,PERSON,artists,"by the same artists, but in reverse"
9079,BODY,BODY,hearing,"the first time hearing it, but it"
9079,PERSON,PERSON,artist,recognized as an artist to watch. The
9079,PERSON,PERSON,artists,audacious and visionary artists of his generation.
9079,PERSON,PERSON,listeners,challenging for some listeners on the first
9079,PERSON,PERSON,artist,genius of the artist. We will hear
9082,PLACE,PLACE,House,members' on Haydn House and the ubiquitous
9098,MEMORY,MEMORY,memories of,"will have fond memories of Quartetto Italiano,"
9098,PERSON,PERSON,listeners,older generation of listeners will have fond
9099,BODY,BODY,FEELING,"POIGNANCY AND MOVING FEELING OF THE &#34;UNFINISHED&#34;,"
9099,BODY,BODY,FEELING,"COMPOSITIONS OF DEEP FEELING, TENDERNESS AND PERSONAL"
9099,BODY,BODY,HEARING,"PERSONAL COMMUNICATION. AFTER HEARING ANY OF THEM,"
9099,BODY,BODY,hearing,Thisis my initial hearing of this work
9099,BODY,BODY,breath,chuckle under my breath and shake my
9104,BODY,BODY,breath,the singing; it's breath-taking for us -
9104,PERSON,PERSON,singer,so influential a singer and I'm certainly
9104,PERSON,PERSON,singers,"orchestra, chorus, supporting singers and conductor are"
9105,BODY,BODY,heart,has tackled the heart of the bel
9105,PERSON,PERSON,people,little wonder why people have dubbed Florez
9105,PERSON,PERSON,artist,"I encountered this artist, Mozart's Mitridate on"
9119,PERSON,PERSON,people,most of the people looking to buy
9119,PERSON,PERSON,fans,"CD are Scholl fans, not pop fans;"
9119,PERSON,PERSON,fans,"fans, not pop fans; we're probably not"
9119,PERSON,PERSON,people,probably not the people he wants to
9119,PERSON,PERSON,singer,"as a pop singer, although the quality"
9119,PERSON,PERSON,people,lot of the people buying this are
9119,PERSON,PERSON,fans,buying this are fans of Andreas Scholl
9119,PERSON,PERSON,people,hope that the people for whom this
9119,PERSON,PERSON,fans,the baroque Scholl fans it's probably one
9121,MEMORY,MEMORY,I recall,"no Russians as I recall, which seems"
9121,PLACE,PLACE,College,the Royal Northern College of Music in
9121,PLACE,PLACE,at home,"he felt completely at home, and on"
9121,PLACE,PLACE,School,and on the School of Keyboard notice
9121,PERSON,PERSON,people,"a lesson with people present, not entertaining"
9137,PERSON,PERSON,fans,"Yes, as his fans say, he does"
9137,PERSON,PERSON,artist,rather than an artist's interpretation or image
9137,PERSON,PERSON,people,from Pollini! Some people debate whether he's
9139,BODY,BODY,touch,"even contains a touch of impressionism, but"
9139,BODY,BODY,hearing,"to be worth hearing, but doesn't reveal"
9144,MEMORY,MEMORY,years ago,cycle a few years ago. After some
9144,PERSON,PERSON,listeners,"will strike some listeners as ""the best"
9144,PERSON,PERSON,listeners,"issue for prospective listeners, but I thought"
9145,BODY,BODY,feeling,tympani. All without feeling the mikes are
9145,BODY,BODY,ears,"(and to my ears, rushed) as some"
9146,BODY,BODY,feeling,"project a real feeling of spontaneous joy,"
9146,PERSON,PERSON,listeners,had meaning and listeners expected his music
9148,BODY,BODY,hearing,review based on hearing this recording on
9149,BODY,BODY,hearing,are interested in hearing a thoroughly musically
9149,PERSON,PERSON,listeners,most and many listeners may find the
9149,PERSON,PERSON,Listeners,but unrelated movements. Listeners who want their
9149,PERSON,PERSON,listeners,and Levine. But listeners who are interested
9150,BODY,BODY,sweat,with breaking a sweat. A good quartet
9150,MEMORY,MEMORY,years ago,"No. 1, fifteen years ago, and it"
9150,MEMORY,MEMORY,years ago,more than fifty years ago -- and
9154,BODY,BODY,body,"Shapey's rather large body of works,He has"
9155,PERSON,PERSON,people,different parts. Many people are fond of
9156,MEMORY,MEMORY,years ago,went defunct some years ago (around 2004
9157,MEMORY,MEMORY,nostalgic,darkly and deeply nostalgic - and to
9157,MEMORY,MEMORY,nostalgia,movement contrasts said nostalgia - and moments
9162,BODY,BODY,breath,he lost his breath at one point.
9162,PERSON,PERSON,people,high notes. Some people referred to her
9162,PERSON,PERSON,people,"underrated, as some people note her only"
9163,BODY,BODY,hearing,not recall ever hearing a better choral
9163,BODY,BODY,feeling,"exactly the same feeling. Arvo P&auml;rt, one"
9163,BODY,BODY,eye,"most attracts my eye,/Where with unwearied zeal,"
9175,BODY,BODY,hearing,and definitely worth hearing - but that
9176,BODY,BODY,feeling,required is a feeling for ardent verismo
9176,PERSON,PERSON,singer,possesses that. The singer's commitment goes far
9177,BODY,BODY,heart,can pierce the heart or express great
9177,BODY,BODY,heart,disc). Voice and heart together have become
9177,PERSON,PERSON,artist,feelings of the artist (whether poet or
9177,PERSON,PERSON,singer,"or clown! or singer??). For, the ""Entrance"
9183,BODY,BODY,hearing,"he lost his hearing, perhaps he would"
9183,MEMORY,MEMORY,years ago,"about a hundred years ago, on an"
9183,PLACE,PLACE,concert hall,"return to the concert hall anytime soon,"
9194,BODY,BODY,hand,The disc at hand is in fact
9198,BODY,BODY,tears,"affects us to tears, seemingly causeless, we"
9198,PERSON,PERSON,artist,"as the creative artist in musical interpretation,"
9198,PERSON,PERSON,Artist,`The Critic as Artist' (1890).~~~
9199,BODY,BODY,hand,"One the one hand, he disapproved the"
9199,BODY,BODY,hand,"On the other hand, he liked part"
9199,BODY,BODY,touch,"Gould's phrasing, his touch and in many"
9199,PERSON,PERSON,people,accents where most people did not.Beethoven's First
9201,BODY,BODY,hand,and the left hand of Andsnes. This
9201,BODY,BODY,touch,under Andsnes's 'vocal' touch. I have three
9201,BODY,BODY,ears,which to my ears would be that
9211,BODY,BODY,hand,On the other hand it is not
9211,PLACE,PLACE,school,a distinctively Russian school of composition had
9215,BODY,BODY,ears,my slightly uninformed ears (only by lack
9215,PLACE,PLACE,University,"Residence at Yale University, and that's where"
9218,PERSON,PERSON,listeners,doomed set from listeners who seem inexplicably
9219,BODY,BODY,ears,harsh to modern ears. Some dismiss any
9219,BODY,BODY,hand,"On the other hand, Menuhin's slow movement"
9219,BODY,BODY,ears,"Brahmsian to modern ears, so I imagine"
9219,BODY,BODY,hand,"On the other hand, Menuhin does get"
9219,PERSON,PERSON,People,People like different things
9219,PERSON,PERSON,Listeners,Marriner and Menuhin. Listeners who are in
9229,BODY,BODY,hearing,"are interested in hearing a ""modern"" performance"
9229,BODY,BODY,hearing,upon a second hearing it should rise
9238,PLACE,PLACE,bar,expected the next bar to follow as
9242,BODY,BODY,hearing,listener will fancy hearing a countertenor rendition
9242,BODY,BODY,hearing,result of re-hearing recordings such as the
9242,BODY,BODY,breath,to catch a breath. Elsewhere the effort
9242,MEMORY,MEMORY,I remember,a young adult. I remember the stir
9242,MEMORY,MEMORY,I remember,bit dryer than I remember them from
9242,MEMORY,MEMORY,nostalgic,and to anyone nostalgic for the halcyon
9242,PLACE,PLACE,bar,"evident in every bar, and his instrumentalists"
9242,PERSON,PERSON,singers,"(including boys), specialist singers who eschewed vibrato"
9242,PERSON,PERSON,singer,"a noted Wagner singer, though by no"
9242,PERSON,PERSON,listeners,"Christmas Oratorio, but listeners allergic to boy"
9245,BODY,BODY,touch,"delicacy of graded touch, is remarkable. It"
9245,PERSON,PERSON,listeners,think most serious listeners would rank Schumann
9295,BODY,BODY,hearing,earphones. Upon first hearing it sounded to
9295,BODY,BODY,ears,"excessive (to my ears, anyway) vibrato.The fifth"
9295,BODY,BODY,heart,"that fascinate my heart, mind, and soul"
9296,BODY,BODY,breath,to take a breath. Sara Mingardo has
9297,BODY,BODY,body,hardware. The full-body sound of the bass
9300,BODY,BODY,tears,The grimace and tears behind the high
9300,BODY,BODY,nose,"sticking up my nose'. Yes, really. Nice"
9301,PERSON,PERSON,singers,"it off, the singers' pronunciation and diction"
9301,PERSON,PERSON,singer,"a very good singer).All in all, a"
9304,MEMORY,MEMORY,I remember,performances there were. I remember an Elise
9304,PLACE,PLACE,University,Regiment at Tufts University Gymnasium (the accoustics
9304,PERSON,PERSON,singer,"of the great singer that she was,"
9304,PERSON,PERSON,singers,opera with great singers. Sills adored Caldwell
9304,PERSON,PERSON,artist,was a great artist. What these discs
9304,PERSON,PERSON,singer,a great great singer. If you want
9307,BODY,BODY,hand,"expression.On the other hand, I would like"
9316,BODY,BODY,tears,shoulders as the tears congealed in his
9316,BODY,BODY,eyes,"congealed in his eyes. I pressed on.""And"
9316,BODY,BODY,tears,"breaking out into tears. ""Those Young Turks"
9316,PLACE,PLACE,room,into my `consulting room'. I boiled up
9317,BODY,BODY,heart,beauty (aurally) and heart (textually). To experience
9317,BODY,BODY,heart,"in more than heart. Du Sollt Gott,"
9317,BODY,BODY,heart,with all thy heart and with all
9322,PERSON,PERSON,people,"next morning, most people in this country"
9324,BODY,BODY,hearing,of grief in hearing the girl's wedding
9325,PERSON,PERSON,fans,from critics and fans alike. Perhaps under
9326,PLACE,PLACE,at home,"popular works, both at home and abroad.Listening"
9326,PERSON,PERSON,listeners,"discordant to Western listeners, are rendered here"
9326,PERSON,PERSON,artist,"verve by an artist like Shaham, that's"
9329,PERSON,PERSON,people,'canary fancier' as people who only enjoy
9329,PERSON,PERSON,people,should think most people may do it
9332,PERSON,PERSON,fans,"again. To opera fans, Allegro is better"
9332,PERSON,PERSON,fans,old standby for fans with shallow pockets
9337,PLACE,PLACE,room,in his music room or parlor. We
9345,PERSON,PERSON,listeners,matter to some listeners. (The role was
9353,BODY,BODY,body,the rather substantial body of music composed
9353,BODY,BODY,hand,"The disc at hand is, unfortunately, its"
9353,BODY,BODY,touch,"any particularly original touch, it is also"
9353,BODY,BODY,hand,"on the other hand. Indeed, one of"
9390,BODY,BODY,hand,compose something nth-hand related to ancient Chinese
9392,BODY,BODY,feeling,and a true feeling of Mahler's devastation.
9393,BODY,BODY,ears,"bothersome to my ears, is the fact"
9393,BODY,BODY,body,"between the main body, and the much"
9393,MEMORY,MEMORY,not forget,disc. And let's not forget an old
9394,BODY,BODY,body,in the main body of the movement.
9394,BODY,BODY,heart,to have your heart pulled out. The
9395,BODY,BODY,feeling,"the harsh, awkward feeling that Mahler calls"
9395,BODY,BODY,feeling,the somewhat nostalgic feeling portrayed in the
9395,BODY,BODY,hand,the subject at hand can encompass so
9395,MEMORY,MEMORY,nostalgic,away the somewhat nostalgic feeling portrayed in
9395,PLACE,PLACE,concert hall,like in the concert hall.Mahler gives the
9396,BODY,BODY,ears,"is, to my ears, characterized by finely"
9396,BODY,BODY,ears,'comfortable' to the ears than Sir Simon
9396,BODY,BODY,ears,"is, to my ears at least, rather"
9397,BODY,BODY,heart,"trombones, should be heart-stopping. Rattle, by emphasizing"
9397,MEMORY,MEMORY,memories of,nothing to displace memories of the awe-inspiring
9398,BODY,BODY,hand,"on the other hand, is exceedingly complex,"
9398,MEMORY,MEMORY,nostalgia,possibly reflects Alwyn's nostalgia for the 'Green
9410,BODY,BODY,ears,"this oratorio, my ears tell me he"
9410,BODY,BODY,blood,like flesh and blood companions. Miah Persson
9410,BODY,BODY,touch,is that extra touch of oratorio character
9410,PLACE,PLACE,College,"Willcocks leading King's College (starring Heather Harper,"
9410,PERSON,PERSON,singers,band and his singers are all and
9411,BODY,BODY,hand,"On the other hand, the legendary Boheme"
9411,PERSON,PERSON,singers,are other great singers sprinkled amongst the
9411,PERSON,PERSON,singers,the other wonderful singers who were around
9411,PERSON,PERSON,artists,"coterie of exclusive artists, right down to"
9411,PERSON,PERSON,singers,to the compremario singers (Piero di Palma
9411,PERSON,PERSON,singers,in recording great singers in their greatest
9412,PERSON,PERSON,fans,many of his fans. The operas that
9419,BODY,BODY,ears,"but to my ears and heart, it"
9419,BODY,BODY,heart,"my ears and heart, it falls way"
9419,BODY,BODY,hearing,do to begin hearing what is missing
9419,BODY,BODY,heart,mystical spirituality by heart problems - either
9419,BODY,BODY,hand,have it at hand now. And if
9423,BODY,BODY,eyes,No doubt Schubert's eyes would have sparkled
9423,PLACE,PLACE,City,of New York City).My one reservation is
9423,PERSON,PERSON,singers,rare for American singers to record Schubert
9423,PERSON,PERSON,singers,songs featured light-voiced singers. Schubert might have
9423,PERSON,PERSON,singer,"dry. Pianist and singer blend beautifully, and"
9423,PERSON,PERSON,singer,"cover portrait (the singer, who here looks"
9430,PERSON,PERSON,artist,this highly gifted artist at his very
9432,BODY,BODY,hand,"On the other hand, the one-act opera"
9435,BODY,BODY,touch,with the golden touch - turned back
9446,PLACE,PLACE,room,"in my listening room, SACD stereo layer"
9446,PERSON,PERSON,people,34 of 35 people recommend it.I wholeheartedly
9450,BODY,BODY,body,a superb instrumental body. Gone are the
9450,PERSON,PERSON,singers,"chorus and the singers are good, although"
9452,BODY,BODY,hearing,"Richard Strauss, and hearing him lead the"
9452,PERSON,PERSON,artist,as a recording artist begins with his
9454,BODY,BODY,touch,however elegant Karajan's touch may be. For
9455,MEMORY,MEMORY,years ago,leap from twenty years ago. I don't
9455,PERSON,PERSON,listeners,"automatically for Naxos, listeners in search of"
9477,BODY,BODY,touch,and the percussive touch in toccata-like movements
9477,BODY,BODY,hand,"genre.On the other hand, I find that"
9477,BODY,BODY,hand,which the right-hand intervals are reproduced by
9477,BODY,BODY,hand,in the left hand. It makes for
9477,BODY,BODY,body,make an impressive body of works. It
9478,BODY,BODY,eye,have kept an eye out for these
9478,MEMORY,MEMORY,years ago,About six years ago I found
9478,PLACE,PLACE,school,hint of old-school(not fusion) jazz--these are musts.
9479,BODY,BODY,ears,"(Just how my ears hear it.)Now, let's"
9479,MEMORY,MEMORY,I recall,my own listening. I recall some fine
9479,PLACE,PLACE,concert hall,waiting in the concert hall wings.The remainder
9492,MEMORY,MEMORY,years ago,"subscriber some five years ago, I do"
9492,MEMORY,MEMORY,years ago,"more than 10 years ago, I can't"
9492,PLACE,PLACE,Concert Hall,"Sonatas recital (&Ouml;rebro Concert Hall, Sweden). Goode's"
9492,PERSON,PERSON,artists,comes to British artists or labels. Having
9492,PERSON,PERSON,artists,Awards and American artists or labels.Back to
9505,MEMORY,MEMORY,years ago,its homeland thirty years ago. Thanks to
9506,BODY,BODY,feeling,"gives us a feeling of spontaneity, which"
9506,PLACE,PLACE,chair,not become first chair until 1960.) I
9510,PERSON,PERSON,fans,all Christa Ludwig fans.
9521,BODY,BODY,body,why this entire body of music has
9521,BODY,BODY,ears,not 'hurt your ears' so to speak.
9521,PLACE,PLACE,on the road,it started me on the road to
9524,BODY,BODY,hearing,at an initial hearing. Rzewski's music is
9524,PERSON,PERSON,listeners,should introduce many listeners to Rezewski's music.Rzewski
9525,BODY,BODY,hearing,a common listener hearing the piece for
9525,PERSON,PERSON,people,and therefore exposing people to music they
9525,PERSON,PERSON,people,to profoundly impact people without a performance
9526,BODY,BODY,hearing,"it'w well worth hearing. For sheer enjoyment,"
9526,MEMORY,MEMORY,years ago,drastically different. Two years ago W-M brought
9535,BODY,BODY,feeling,with excitement. This feeling continues through to
9535,BODY,BODY,hearing,looks forward to hearing them.Enthusiastic recommendation.Scott Morrison
9535,MEMORY,MEMORY,years ago,"Two years ago I wrote,"
9535,PLACE,PLACE,room,bursting into a room with excitement. This
9536,BODY,BODY,feeling,"review captures the feeling of Guy's playing,"
9536,BODY,BODY,hearing,sheer pleasure of hearing such a beautiful
9536,BODY,BODY,feeling,and Mr. Morrison's feeling of generic playing
9536,MEMORY,MEMORY,years ago,from a few years ago). Philippe Jordan
9536,PLACE,PLACE,house,to burn the house down. My only
9540,BODY,BODY,Hearing,everyone on stage. Hearing this performance once
9540,BODY,BODY,hearing,"in a forge, hearing hammer-blows striking an"
9540,BODY,BODY,arm,"with his left arm, then giving the"
9540,MEMORY,MEMORY,nostalgic,years makes me nostalgic. It was wonderful
9540,MEMORY,MEMORY,I recall,"music making.In particular, I recall the very"
9547,BODY,BODY,feeling,"same time.For my feeling, La Mer has"
9547,BODY,BODY,breath,"you hold your breath. Ok, I could"
9548,MEMORY,MEMORY,years ago,"available a few years ago, it would"
