doc_id,rule_name,category,span_text,context
2544,BODY,BODY,hand,"that.On the other hand, here she gives"
2544,PERSON,PERSON,singers,everyone of the singers sing very beautifully
2545,BODY,BODY,tears,the Quintet brought tears to my eyes)
2545,BODY,BODY,eyes,tears to my eyes) vs. a totally
2545,PERSON,PERSON,singers,The marvelous character singers Benno Kusche and
2545,PERSON,PERSON,Singer,"be THE &quot;Master Singer.&quot; Indeed, he even"
2545,PERSON,PERSON,singer,only really substandard singer in the Solti
2546,PERSON,PERSON,singers,demands really impressive singers who can suddenly
2547,BODY,BODY,hand,the set at hand. The Gramophone was
2547,PERSON,PERSON,singers,"or even mediocre singers, and some are"
2547,PERSON,PERSON,singer,the one dreadful singer who becomes the
2547,PERSON,PERSON,fans,set appeals to fans of Kempe and
2547,PERSON,PERSON,singer,"a coarse, loud singer, disqualifies the whole"
2547,PERSON,PERSON,singers,"the traditional German singers we're used to,"
2547,PERSON,PERSON,artist,"but a routine artist, makes nothing of"
2547,PERSON,PERSON,artist,"is a real artist, and every note"
2548,PERSON,PERSON,fans,not only for fans of Sir Georg
2549,BODY,BODY,touch,compare the light touch that Monteux applies
2549,BODY,BODY,hand,learn them first hand these days.No matter
2549,BODY,BODY,touch,given a light touch and the variations
2549,MEMORY,MEMORY,I remember,(Brahms) and 1959(Haydn). I remember buying the
2550,BODY,BODY,feet,"lighter on their feet.The Brahms Haydn Variations,"
2551,BODY,BODY,ears,"For my poor ears, Hotter stands head"
2552,BODY,BODY,feeling,and has remarkable feeling. Nilsson is powerful
2552,PERSON,PERSON,singers,"undertaking for minor singers or orchestra. Furthermore,"
2553,BODY,BODY,hearing,I recall first hearing Joshua Rifkin many
2553,BODY,BODY,ears,ringing in my ears is the wonderful
2553,MEMORY,MEMORY,years ago,repeats-are-compulsory enforcers 40 years ago. For my
2553,MEMORY,MEMORY,I recall,and general musicality. I recall first hearing
2553,MEMORY,MEMORY,years ago,Joshua Rifkin many years ago when he
2553,PLACE,PLACE,bar,sonata-style compositions double-bar repeats mean that the
2554,BODY,BODY,ears,"least to my ears, sometimes sound a"
2555,BODY,BODY,throat,back on her throat (around 1997). There
2555,PERSON,PERSON,singer,take the &quot;opera singer&quot; out of opera
2556,PERSON,PERSON,singers,"generation of Russian singers, many of whom"
2557,MEMORY,MEMORY,remembering,grandparents talk about remembering the good old
2557,PERSON,PERSON,artists,the incredible young artists not only &quot;picking
2557,PERSON,PERSON,singer,"case, this great singer is still in"
2557,PERSON,PERSON,singers,the most diverse singers in the world;
2557,PERSON,PERSON,singers,tell of great singers with whom we
2558,PERSON,PERSON,listeners,the Oratorio). So listeners who don't want
2559,BODY,BODY,feeling,"Evangelist-very subtle, excellent feeling for text and"
2559,BODY,BODY,breath,often out of breath in the Laudamus
2559,PERSON,PERSON,artist,"Hollweg, a fine artist, sings the tenor"
2565,BODY,BODY,touch,has a light touch that downplays some
2565,BODY,BODY,touch,but never loses touch with their central
2566,BODY,BODY,ears,to adjust the ears away from expecting
2566,BODY,BODY,hearing,the listener were hearing it as the
2566,MEMORY,MEMORY,years ago,Salzburg almost 60 years ago.
2566,PERSON,PERSON,singers,fragmented both these singers descend into vocal
2566,PERSON,PERSON,singers,it as the singers would hear it
2566,PERSON,PERSON,singers,whether they are singers you've ever encountered
2567,PLACE,PLACE,house,"in the oepra house, but her gleaming"
2569,BODY,BODY,ears,"- get your ears out, and as"
2569,BODY,BODY,ears,concert: Use your ears like a man.
2569,BODY,BODY,ears,like: Use your ears like a grown-up.The
2569,BODY,BODY,ears,"appeal, once your ears have adjusted to"
2569,BODY,BODY,ears,some balm for ears sore wounded by
2569,PERSON,PERSON,singers,by community chorus singers.Now comes a local
2571,BODY,BODY,touch,"without an original touch. The ""Ballad to"
2572,PERSON,PERSON,listeners,I hope curious listeners will investigate the
2573,PERSON,PERSON,artists,difficult until the artists simply aren?t up
2574,PERSON,PERSON,artists,difficult until the artists simply aren't up
2575,PLACE,PLACE,at home,sound decidedly less at home and decisive
2576,BODY,BODY,hand,"on the other hand, technically accomplished and"
2576,BODY,BODY,touch,conciliatory-sounding with a touch of resignation and
2578,MEMORY,MEMORY,nostalgic,"morose, with occasional nostalgic respites; all in"
2580,MEMORY,MEMORY,memories of,"I had better memories of this one,"
2581,BODY,BODY,hearing,"whose music bears hearing. That group, along"
2581,PLACE,PLACE,room,issues to make room for new acquisitions.
2581,PLACE,PLACE,City,our wonderful Kansas City Library system and
2581,PLACE,PLACE,school,"the post-Wagnerian Austro-German school, including their use"
2582,BODY,BODY,hearing,"music, though worth hearing, and the Prelude"
2582,BODY,BODY,touch,lacks the last touch of finesse. If
2584,PERSON,PERSON,listeners,of classical music listeners. Following Holmboe's quartets
2584,PERSON,PERSON,listeners,"the start, but listeners are sure to"
2585,PERSON,PERSON,fans,"incomplete, committed Holmboe fans will probably end"
2586,BODY,BODY,heart,"choir. But the heart of ""The Echoing"
2586,PERSON,PERSON,Fans,orchestra and choir. Fans of classic Ligeti
2587,PERSON,PERSON,listeners,recommend these to listeners who having already
2595,BODY,BODY,hearing,the impression of hearing too much of
2595,BODY,BODY,heart,its grandiose and heart-lifting finale is faintly
2597,BODY,BODY,hearing,is nevertheless worth hearing.I guess we should
2597,PLACE,PLACE,University,and Nebraska Wesleyan University Choir are unfamiliar
2598,BODY,BODY,feet,figurine (just five feet tall) achieving such
2598,BODY,BODY,touch,a lightness of touch was something from
2605,BODY,BODY,hand,athletic leaps and hand-crossings which are well-known
2605,BODY,BODY,touching,"his ""art of touching the keyboard"" seem"
2606,PERSON,PERSON,singers,instead gave the singers lovely melodies to
2606,PERSON,PERSON,singers,entire performance. The singers are outstanding both
2607,BODY,BODY,feeling,their music with feeling and drama.It is
2607,BODY,BODY,chest,cannot exploit your chest voice or high
2607,MEMORY,MEMORY,years ago,more than 20 years ago. And when
2607,PERSON,PERSON,people,of the few people reviewing this recording
2607,PERSON,PERSON,singers,crop of student singers at the Cincinnati
2609,BODY,BODY,feet,a frame 18 feet wide and 54
2609,BODY,BODY,body,"listener in mind, body and spirit.The Mass"
2611,PERSON,PERSON,fans,fervent or devoted fans of the new
2612,BODY,BODY,ears,wrong with my ears if I am
2613,BODY,BODY,breath,they are a breath of fresh air
2615,BODY,BODY,breath,they are a breath of fresh air
2616,BODY,BODY,breath,they are a breath of fresh air
2617,BODY,BODY,hand,having both at hand. Sometimes I may
2617,MEMORY,MEMORY,I recall,particularly inspirational conductor--as I recall from playing
2618,BODY,BODY,hand,having both at hand. Sometimes I may
2618,MEMORY,MEMORY,I recall,particularly inspirational conductor--as I recall from playing
2619,BODY,BODY,touch,"For a dramatic touch, cannon and bells"
2620,BODY,BODY,cry,but here you'll cry at the music
2620,BODY,BODY,feeling,"different reason, the feeling is interior, more"
2620,BODY,BODY,heart,"outside, not your heart breaking for your"
2621,BODY,BODY,breath,they are a breath of fresh air
2623,BODY,BODY,feeling,with the uneasy feeling that they've been
2623,BODY,BODY,feeling,much the same feeling. Martin Butler captures
2623,BODY,BODY,touch,providing a welcome touch of humanity to
2623,PLACE,PLACE,University,"Laboratory at Princeton University, named in memory"
2623,PLACE,PLACE,university,be expected from university academics presented with
2623,PERSON,PERSON,listeners,lasting sustenance for listeners thereafter.Paul Lansky's &quot;just_more_idle_chatter&quot;
2623,PERSON,PERSON,listeners,"9 minutes, most listeners may just be"
2624,BODY,BODY,hand,the material at hand. So it's worth
2624,PERSON,PERSON,people,grand fantasies that people like Hummel wrote
2627,PERSON,PERSON,people,is to expose people to a sampling
2627,PERSON,PERSON,listeners,inexpensive and let listeners explore different composers
2628,MEMORY,MEMORY,years ago,made like 5 years ago and the
2628,PLACE,PLACE,room,"there, no much room is left to"
2630,PLACE,PLACE,Club,"The Meyerbeer Fan Club, a good group"
2630,PERSON,PERSON,singers,makes on his singers. I think Meyerbeer
2630,PERSON,PERSON,Fans,soprano Julia Varady. Fans of Ms Varady
2634,BODY,BODY,ears,"up to the ears, and how the"
2637,BODY,BODY,throat,somewhere in his throat and something were
2637,PLACE,PLACE,City,"the New York City Opera presentation,are based"
2637,PERSON,PERSON,singers,diction of the singers is not as
2637,PERSON,PERSON,singers,volume because the singers sometimes don't seem
2638,BODY,BODY,body,"singers aren't using body mikes, which is"
2638,MEMORY,MEMORY,years ago,"this operetta 2 years ago, for some"
2638,PERSON,PERSON,artists,"within by various artists, so although I'm"
2638,PERSON,PERSON,singers,show where the singers aren't using body
2638,PERSON,PERSON,singers,deep and the singers all rather pleasing.
2643,PERSON,PERSON,singer,a composer and singer for the next
2643,PERSON,PERSON,singers,support of the singers. The voices flow
2644,BODY,BODY,hand,"have a free hand, as they must"
2644,BODY,BODY,touch,"maintained a light touch throughout, but sounds"
2645,BODY,BODY,heart,artistic and emotional heart of the entire
2645,PERSON,PERSON,artist,Pretty much every artist featured in it
2645,PERSON,PERSON,artists,rather than the artists portraying them.... I
2645,PERSON,PERSON,artists,none of the artists who play Luther
2646,BODY,BODY,feeling,"death. My personal feeling was, if it"
2646,BODY,BODY,hand,"on the other hand, is one of"
2646,BODY,BODY,hand,"On the other hand, his chorus of"
2646,BODY,BODY,eyes,"square jaw, popping eyes and a shock"
2646,BODY,BODY,ears,but to my ears Van Dam is
2646,MEMORY,MEMORY,memories of,does not efface memories of de los
2646,PERSON,PERSON,singer,Tourangeau and the singer (I forget her
2647,PLACE,PLACE,bar,Matthieu Ikeroart (bar) Fate II; Bertrand Bontoux
2648,PERSON,PERSON,singers,"were watching these singers live. Tenors aside,"
2649,BODY,BODY,ears,is to my ears the most fully
2650,BODY,BODY,feeling,have a strong feeling of rythm in
2650,BODY,BODY,feeling,not have a feeling for an even
2650,BODY,BODY,foot,still tap my foot if I want
2650,MEMORY,MEMORY,I remember,the CD that I remember so fondly
2650,PLACE,PLACE,college,in some small college) it would be
2652,BODY,BODY,hearing,"practice"". Still, re-hearing them today, in view"
2652,BODY,BODY,mouth,"Giardino Armonico), my mouth was left gaping."
2652,BODY,BODY,hearing,Gardellino throughout from hearing the modern transverse
2653,BODY,BODY,hand,"on the other hand, given the nature"
2655,BODY,BODY,touch,"opera recordings don't touch. Tennstedt, sadly, was"
2655,BODY,BODY,heart,"anyone with a heart, this is possibly"
2655,PLACE,PLACE,City,including New York City's Metropolitan Opera. Her
2655,PLACE,PLACE,City,in New York City's Lincoln Center with
2655,PERSON,PERSON,singer,"1980's, African-American opera singer Jessye Norman was"
2655,PERSON,PERSON,Fans,it's thoroughly enjoyable. Fans of the diva
2657,BODY,BODY,throat,lump in my throat - til the
2657,BODY,BODY,tears,- til the tears start flowingfrom the
2657,MEMORY,MEMORY,I remember,I remember a few
2657,MEMORY,MEMORY,years ago,remember a few years ago when the
2658,BODY,BODY,feeling,"""glow"" with a feeling of serenity and"
2658,BODY,BODY,hand,"children's chorus), whose hand in marriage is"
2659,PERSON,PERSON,singers,distant from the singers here and the
2660,BODY,BODY,body,case of the body not able any
2660,BODY,BODY,breath,annoyingly end a breath after those of
2660,PLACE,PLACE,bar,"on the next bar). Other than that,"
2660,PERSON,PERSON,listeners,"will bother most listeners, and it takes"
2662,PLACE,PLACE,College,"Although, the King's College Choir is mostly"
2664,BODY,BODY,touching,"not overromanticized, deeply touching without the least"
2664,PERSON,PERSON,listeners,I would urge listeners to make every
2666,PERSON,PERSON,singers,fact that Keilberth's singers deliver their own
2667,BODY,BODY,eye,with a roving eye - Nicolai Gedda
2667,BODY,BODY,Blood,"""Wiener Blut""--literally ""Viennese Blood"" but perhaps more"
2667,BODY,BODY,eye,mistress and his eye is roving after
2667,BODY,BODY,hand,Strauss took no hand in the creation
2667,BODY,BODY,hand,or even later hand. This leads to
2667,BODY,BODY,touch,spritzer (with a touch of peach schnapps
2667,PERSON,PERSON,listeners,cheers from discerning listeners. There appears to
2672,BODY,BODY,hand,her own unwitting hand (& Chevruese). By
2672,PERSON,PERSON,singer,be a Donizetti singer of the first
2672,PERSON,PERSON,singers,lighting and accomplished singers it would be
2674,BODY,BODY,hand,"On the other hand, despite their hyperbolic"
2674,PERSON,PERSON,artist,was a creative artist of nearly the
2675,PLACE,PLACE,City,"stage of development.Quiet City, for English Horn,"
2677,MEMORY,MEMORY,years ago,"Two or three years ago, Tahra issued"
2677,PLACE,PLACE,school,"senior in high school, the Santa Monica"
2679,BODY,BODY,feeling,emotive meaning and feeling. Of course almost
2684,BODY,BODY,hand,the peasants first hand. These musically gifted
2723,BODY,BODY,tears,of rips or tears in an underlying
2726,MEMORY,MEMORY,I remember,minor - that I remember can be
2729,PERSON,PERSON,listeners,the whole challenged listeners to separate the
2729,PERSON,PERSON,fans,"checking out for fans of Norgard, and"
2730,BODY,BODY,hearing,playful fascination in hearing notes from the
2730,BODY,BODY,hand,"the closed (left) hand, and the other"
2730,BODY,BODY,hand,in the right hand and struck against
2732,BODY,BODY,touching,"other strings, a touching display of romantic"
2732,MEMORY,MEMORY,nostalgic,"it with a nostalgic hue, particularly in"
2732,PLACE,PLACE,University,"Residence' at Yale University, which fact may"
2732,PERSON,PERSON,listeners,"the piece on listeners is undeniable, aided"
2733,BODY,BODY,heart,depictions of the heart's despair in Romantic
2733,BODY,BODY,feeling,"has a ""tacked-on"" feeling to it..These marvellous"
2734,BODY,BODY,feeling,"lateness and its feeling, the quintet and"
2734,BODY,BODY,feeling,passion and romantic feeling. Many listeners find
2734,BODY,BODY,heart,"marked lento, the heart of the work."
2734,BODY,BODY,feeling,to sway with feeling and reach a
2734,BODY,BODY,body,but high quality body of music before
2734,BODY,BODY,hand,due to d'Indy's hand in the final
2734,PERSON,PERSON,listeners,romantic feeling. Many listeners find eroticism in
2734,PERSON,PERSON,listeners,high level. Many listeners find the slow
2735,PLACE,PLACE,City,"orbi"" (To the City and the World)"
2735,PLACE,PLACE,House,Go into the House of the Lord)
2736,PERSON,PERSON,singers,of their art: singers?? instrumentalists?? Never before
2739,BODY,BODY,breath,even hold one's breath to be able
2739,BODY,BODY,ears,of torturing my ears with compositions of
2739,PLACE,PLACE,room,are in the room I'm sitting in
2739,PLACE,PLACE,concert hall,hear in a concert hall either. How
2739,PERSON,PERSON,artist,"record of the artist's effort, sometimes the"
2739,PERSON,PERSON,artist,respect to the artist's breathing?
2740,BODY,BODY,chest,"or force her chest voice, which Santuzza's"
2740,BODY,BODY,hand,"on the other hand, pulls out all"
2740,BODY,BODY,touching,"first moment, is touching in its own"
2740,PLACE,PLACE,City,Cavaradossi from Mexico City with Callas). as
2742,BODY,BODY,feeling,al fine without feeling uncomfortable. As for
2742,BODY,BODY,hearing,engaging on first hearing like the works
2742,MEMORY,MEMORY,I remember,"and Forefather's day"". I remember how disappointed"
2743,BODY,BODY,hand,get out of hand; it's always filled
2743,BODY,BODY,touch,somehow manages to touch us in the
2743,PERSON,PERSON,singers,poor cast of singers and the second
2743,PERSON,PERSON,singers,drawback is the singers. Other reviewers have
2743,PERSON,PERSON,singers,quality cast of singers in the finale
2744,BODY,BODY,heart,I haven't the heart to comment on
2744,PLACE,PLACE,School,hour. The Juilliard School Chorus sounds like
2744,PERSON,PERSON,singer,Arroyo - a singer I generally admire
2752,BODY,BODY,hearing,have felt after hearing his recent performances
2752,PERSON,PERSON,singer,"doing that, a singer needs a technical"
2752,PERSON,PERSON,singers,technical background that singers today don't have
2752,PERSON,PERSON,singer,of this great singer. If everything works
2753,BODY,BODY,tears,moved me to tears - Sills didn't.There
2753,PERSON,PERSON,singers,the male lead singers from the Sills
2753,PERSON,PERSON,singer,- what a singer! On the callas
2753,PERSON,PERSON,singer,"a VERY powerful singer. Also, I felt"
2753,PERSON,PERSON,singer,"purely as a singer, callas was absolutely"
2754,BODY,BODY,hand,"on the other hand, profess to detect"
2754,PLACE,PLACE,bar,losing a single bar of the golden
2754,PERSON,PERSON,fans,lore among opera fans that the role
2754,PERSON,PERSON,Fans,match for them. Fans of La Divina
2754,PERSON,PERSON,singers,of the great singers of the Twentieth
2754,PERSON,PERSON,singer,much an A-list singer and sounds like
2754,PERSON,PERSON,fans,too-confident insistence of fans that the remarks
2754,PERSON,PERSON,singers,of Callas.) The singers in the smaller
2755,PERSON,PERSON,singer,and no other singer could capture the
2755,PERSON,PERSON,singers,"unachieved by other singers. The madscene, the"
2756,BODY,BODY,blood,of flesh and blood caught in the
2756,BODY,BODY,heart,tug at one's heart. On the other
2756,BODY,BODY,hand,"On the other hand, she never sacrifices"
2758,MEMORY,MEMORY,reminds me of,"music that...well, it reminds me of the"
2758,PERSON,PERSON,people,"could help change people, to make them"
2761,BODY,BODY,hearing,get bored by hearing only a couple
2761,PERSON,PERSON,listeners,instant appeal for listeners and composers alike.
2761,PERSON,PERSON,people,remain plenty of people who get bored
2761,PERSON,PERSON,people,dance for the people into a courtly
2764,BODY,BODY,body,him for the body of her father
2764,PERSON,PERSON,people,annoying to some people but I found
2764,PERSON,PERSON,singers,the score. The singers are quite good
2765,BODY,BODY,hand,"On the other hand, the intimate partnership"
2765,PERSON,PERSON,artists,"familiar with the artists. Certainly, the entire"
2766,BODY,BODY,heart,"is the real heart of the opera,"
2766,BODY,BODY,touch,"is a wonderful touch, the grotesque interwoven"
2767,BODY,BODY,hearing,work well worth hearing indeed.The coupling is
2767,BODY,BODY,hand,under the sure hand of Nicol&aacute;s Pasquet.
2767,BODY,BODY,feeling,shake off the feeling that an extra
2767,BODY,BODY,touch,that an extra touch of refinement and
2768,PLACE,PLACE,bar,"throughout each work, bar on bar, making"
2768,PLACE,PLACE,bar,"work, bar on bar, making exceptional demands"
2768,PERSON,PERSON,my friend,offerings and like my friend before me
2769,PLACE,PLACE,school,the Russian violin school are evident in
2769,PERSON,PERSON,artists,to from Russian artists of a certain
2771,BODY,BODY,hand,"on the one hand, and ponderous plodding"
2771,BODY,BODY,touch,you get a touch more elemental power
2771,BODY,BODY,hand,do.On the other hand Barbirolli's scherzo is
2771,PERSON,PERSON,listeners,to bother most listeners.]All this would be
2772,BODY,BODY,heart,"arias, but the heart of each act"
2772,BODY,BODY,feeling,a range of feeling and emotion. Lovers
2775,PLACE,PLACE,bar,from the first bar. D Minor does
2775,PERSON,PERSON,artists,and character. For artists of the stature
2775,PERSON,PERSON,artist,"Schnabel, a honest artist that many of"
2783,BODY,BODY,ears,(Philips). To my ears Bertini and de
2784,PERSON,PERSON,fans,help interested opera fans decide which recordings
2793,BODY,BODY,hearing,unalloyed pleasure of hearing a technique that
2794,BODY,BODY,breath,"and structural conception, breath-taking sonority and tone;"
2794,BODY,BODY,touch,"the light ""cantabile"" touch and inner depth"
2794,BODY,BODY,hearing,listener - just hearing it once carves
2794,MEMORY,MEMORY,not forget,And let us not forget - before
2799,MEMORY,MEMORY,years ago,a couple of years ago by EMI.
2800,BODY,BODY,hearing,"is why after hearing Karajan's ""bleeding chunks"""
2800,BODY,BODY,hearing,14 hours after hearing only two and
2800,BODY,BODY,arm,together with the arm-chair you're sitting in.
2800,BODY,BODY,feeling,I can't help feeling sorry for the
2800,PLACE,PLACE,chair,with the arm-chair you're sitting in. I
2800,PERSON,PERSON,singers,my mind Karajan's singers are distinctly superior
2800,PERSON,PERSON,singers,"opinion the only singers in Solti's ""Ring"""
2800,PERSON,PERSON,singer,is the only singer who is on
2800,PERSON,PERSON,singers,"Also, there are singers in the Solti's"
2800,PERSON,PERSON,singer,"say terrible, a singer could have been"
2800,PERSON,PERSON,singers,often easily dismissed singers. None of the
2800,PERSON,PERSON,singers,some of Solti's singers are almost a
2802,BODY,BODY,hearing,thought I was hearing a clarino trumpet
2802,BODY,BODY,hearing,"never get a hearing! Thankfully, this is"
2906,PERSON,PERSON,listeners,few collectors and listeners. Mode Records produced
2908,PLACE,PLACE,City,of New York City renders this. The
2909,BODY,BODY,hand,"on the other hand, feature the postwar"
2914,BODY,BODY,hand,"on the other hand, is a tightly"
2914,MEMORY,MEMORY,childhood,have a traumatic childhood but in adulthood
2915,BODY,BODY,ears,this set of ears); the Mahler in
2916,PERSON,PERSON,my wife,hit i told my wife New Orleans
2917,MEMORY,MEMORY,years ago,"on impulse ten years ago, I knew"
2923,BODY,BODY,blood,Mozartian baritone (by blood seemingly) in his
2923,BODY,BODY,ears,something which operaphiles ears usually miss. They
2923,BODY,BODY,hearing,again we are hearing the old school
2923,PLACE,PLACE,school,"in the old school German fashion, sings"
2923,PLACE,PLACE,school,hearing the old school Mozart soprano school.
2923,PLACE,PLACE,school,"school Mozart soprano school. Lorengar, like her"
2923,PERSON,PERSON,SINGERS,of power.ABOUT THE SINGERS: First we have
2923,PERSON,PERSON,singer,"mostly lyric baritone singer who, educated in"
2923,PERSON,PERSON,singers,The other male singers here to note
2923,PERSON,PERSON,singers,other Zauberflotes with singers you always find
2923,PERSON,PERSON,singers,touches and good singers. Enjoy
2924,PLACE,PLACE,room,Prague plenty of room to exhibit their
2925,MEMORY,MEMORY,memories of,"before 1950, conjuring memories of similar works"
2925,PERSON,PERSON,listeners,an appeal for listeners interested in chamber
2931,BODY,BODY,hand,was an old-hand at Wagner - even
2931,BODY,BODY,touch,said of multiple touch-points throughout (not least
2931,PLACE,PLACE,bar,"that. Here, every bar exhibits grip, patience,"
2932,BODY,BODY,touch,"a light, elegant touch. The result is"
2932,BODY,BODY,feeling,the same timeless feeling on a reduced
2936,BODY,BODY,touch,"was 18. Gieseking's touch is, as always,"
2936,BODY,BODY,breath,or hold your breath until EMI decides
2937,BODY,BODY,touch,"in terms of touch, had declined form"
2937,BODY,BODY,eye,territory is an eye-opener.
2938,BODY,BODY,touch,soft and singing touch is evident. And
2938,BODY,BODY,breath,collective intake of breath and then a
2939,BODY,BODY,hand,direction. Okashiro's left-hand playing is strong and
2939,BODY,BODY,hand,"uses. Her right-hand playing is quick, dexterous,"
2986,BODY,BODY,touch,hear. A nice touch upon which to
2986,PLACE,PLACE,room,that there is room for improvement. This
2986,PLACE,PLACE,Room,"&quot;Fatal Attraction,&quot; &quot;A Room With A View,&quot;"
2986,PERSON,PERSON,singers,"grouped together. Featured singers include Montserat Caballe,"
3002,BODY,BODY,feeling,"right sense of feeling. She gives ""Voi"
3130,MEMORY,MEMORY,years ago,seen it many years ago in England
3130,PERSON,PERSON,my father,so I BEGGED my father to lend
3130,PERSON,PERSON,people,"to so many people, over the years"
3179,BODY,BODY,hearing,gigantic cliche - hearing it played with
3179,MEMORY,MEMORY,Reminds me of,and unshakeable conviction. Reminds me of my
3179,PERSON,PERSON,my dad,Reminds me of my dad's generation when
3180,BODY,BODY,breath,it takes your breath away. Added to
3180,PERSON,PERSON,singers,or abandons the singers. He is helped
3180,PERSON,PERSON,singers,"to this, the singers are in many"
3180,PERSON,PERSON,singer,"herself, not a singer. Unfortunately, she only"
3180,PERSON,PERSON,singer,"is an intelligent singer, but possesses nowhere"
3181,PERSON,PERSON,artist,"undoubtedly a magnificent artist, but as has"
3181,PERSON,PERSON,singer,"is a fine singer, but no match"
3182,PERSON,PERSON,singers,of the excellent singers on the recording.
3182,PERSON,PERSON,singers,"Karajan chose his singers well: in retrospect,"
3182,PERSON,PERSON,people,"and as many people still think), but"
3183,BODY,BODY,hearing,"the rest. When hearing this Ring, one"
3183,BODY,BODY,hand,"On the other hand, he is also"
3183,BODY,BODY,ears,delight to the ears. Catherine Gayer as
3183,PERSON,PERSON,singers,"good one; his singers, however, sadly heighten"
3183,PERSON,PERSON,singers,"very eerie.Now, the singers may not be"
3183,PERSON,PERSON,listeners,"almost all Ring listeners. But of course,"
3185,BODY,BODY,hearing,"contemplative, but when hearing how he uses"
3185,PLACE,PLACE,room,Karajan's conducting makes room for the singers
3185,PERSON,PERSON,singers,"lingering.What about the singers, then? Crespin as"
